{
  "schema_version": "slot-alignment.continuous-execution-policy.v2",
  "policy_id": "continuous-alignment-execution-v2",
  "version": "2.0.0",
  "source_path": "assets/policies/continuous_execution_policy.v2.json",
  "retry_limit": 2,
  "formal_candidate_limit_enabled": false,
  "auto_regenerate_reports": true,
  "auto_rebuild_invalid_samples": true,
  "auto_repair_script_equivalence_failures": true,
  "request_user_recertification_for_derived_script": false,
  "derived_script_boundary_failure_action": "restore_certified_script_and_auto_waive_affected_metrics",
  "auto_expand_formal_samples_until_qualified_or_structural_unattainability": true,
  "auto_expand_calibration_budget_until_pass_or_structural_unattainability": true,
  "auto_expand_formal_budget_until_pass_or_structural_unattainability": true,
  "budget_exhaustion_stops_execution": false,
  "candidate_exhaustion_stops_execution": false,
  "budget_extension_requires_user_approval": false,
  "auto_return_to_calibration_after_formal_failure": true,
  "auto_continue_after_candidate_failure": true,
  "auto_fix_task_runtime_metadata": true,
  "auto_waive_insufficient_data": true,
  "auto_waive_structurally_unattainable": true,
  "auto_waive_forbidden_boundary_unattainability": true,
  "request_user_for_forbidden_boundary_change": false,
  "finish_with_blocked_or_waived_report": true,
  "interrupt_user_during_execution": false,
  "business_decision_windows": ["preflight", "final_report"],
  "preflight_metric_extension_decision_required": true,
  "preflight_sample_count_confirmation_required": true,
  "full_recount_when_user_requested": true,
  "auto_adopt_valid_full_recount_result": true,
  "post_recount_user_confirmation_required": false,
  "preflight_python_script_identity_confirmation_required": true
}
